アクター群	アクター	説明
管理部門	人事部担当者	スタッフの登録・管理、権限ロールの割り当て、スタッフの連絡先管理・パスワードリセットを行う
運営部門	予約管理部担当者	サイトコントローラーとの連携設定、外部予約の取り込み・ステータス更新、ダブルブッキング発生時の調整、予約一覧・カレンダー画面での在庫管理、客室タイプの在庫調整・料金調整を行う
現場スタッフ	フロントスタッフ	チェックイン当日のゲスト確認、宿泊者名簿の回収と確認、お客様の要望更新、部屋のアサイン、チェックアウト処理、清掃スタッフへの引き継ぎ、緊急時の滞在者確認を行う
現場スタッフ	清掃スタッフ	清掃対象部屋一覧の確認、清掃状況の更新、部屋ごとの備品不足の記録、フロントへの清掃完了通知を行う
外部利用者	ゲスト	宿泊者名簿の入力、事前チェックイン案内メールの受領、予約内容の確認、要望の事前入力を行う
管理部門	経理担当者	売上データの確認、売上レポートの作成と分析、ADR・OCC・RevPARなどの指標を用いた売上分析を行う
運営部門	施設管理者	施設情報・部屋タイプ・部屋の基本情報管理、レート・プライシング管理、シーズン登録を行う
